[
  {
    "id": 1001,
    "name": "Elena Ramos",
    "referring_hospital": "CPMC Van Ness",
    "diet_orders": [
      "diabetic",
      "cardiovascular"
    ],
    "allergies": [],
    "max_sodium_mg": 600,
    "carb_range_g": [
      45,
      65
    ],
    "cuisine_pref": "American",
    "dislikes": [
      "coconut milk"
    ],
    "cooking_ability": "stovetop",
    "address_zone": "Chinatown",
    "meals_per_week": 5
  },
  {
    "id": 1002,
    "name": "Daniel Mendoza",
    "referring_hospital": "Saint Francis Memorial",
    "diet_orders": [
      "cardiovascular"
    ],
    "allergies": [],
    "max_sodium_mg": 600,
    "carb_range_g": [
      45,
      75
    ],
    "cuisine_pref": "Vietnamese",
    "dislikes": [],
    "cooking_ability": "microwave",
    "address_zone": "Excelsior",
    "meals_per_week": 7
  },
  {
    "id": 1003,
    "name": "Fatima Reyes",
    "referring_hospital": "CPMC Van Ness",
    "diet_orders": [
      "diabetic"
    ],
    "allergies": [],
    "max_sodium_mg": 800,
    "carb_range_g": [
      45,
      60
    ],
    "cuisine_pref": "Italian",
    "dislikes": [
      "coconut milk",
      "lentils"
    ],
    "cooking_ability": "none",
    "address_zone": "Bayview-Hunters Point",
    "meals_per_week": 7
  },
  {
    "id": 1004,
    "name": "Rosa Ramos",
    "referring_hospital": "UCSF Medical Center",
    "diet_orders": [
      "diabetic",
      "cardiovascular"
    ],
    "allergies": [
      "fish",
      "dairy"
    ],
    "max_sodium_mg": 600,
    "carb_range_g": [
      40,
      55
    ],
    "cuisine_pref": "Mexican",
    "dislikes": [],
    "cooking_ability": "microwave",
    "address_zone": "Chinatown",
    "meals_per_week": 7
  },
  {
    "id": 1005,
    "name": "Omar Singh",
    "referring_hospital": "Zuckerberg San Francisco General",
    "diet_orders": [
      "diabetic"
    ],
    "allergies": [
      "tree_nut"
    ],
    "max_sodium_mg": 800,
    "carb_range_g": [
      45,
      65
    ],
    "cuisine_pref": "Chinese",
    "dislikes": [],
    "cooking_ability": "microwave",
    "address_zone": "Bayview-Hunters Point",
    "meals_per_week": 5
  },
  {
    "id": 1006,
    "name": "Benigno Singh",
    "referring_hospital": "Chinese Hospital",
    "diet_orders": [
      "renal"
    ],
    "allergies": [],
    "max_sodium_mg": 550,
    "carb_range_g": [
      40,
      70
    ],
    "cuisine_pref": "Italian",
    "dislikes": [],
    "cooking_ability": "microwave",
    "address_zone": "Chinatown",
    "meals_per_week": 7
  },
  {
    "id": 1007,
    "name": "Wei Garcia",
    "referring_hospital": "CPMC Van Ness",
    "diet_orders": [
      "renal"
    ],
    "allergies": [],
    "max_sodium_mg": 600,
    "carb_range_g": [
      35,
      70
    ],
    "cuisine_pref": "Indian",
    "dislikes": [],
    "cooking_ability": "microwave",
    "address_zone": "SoMa",
    "meals_per_week": 7
  },
  {
    "id": 1008,
    "name": "Minh Kim",
    "referring_hospital": "Kaiser Permanente San Francisco",
    "diet_orders": [
      "diabetic"
    ],
    "allergies": [],
    "max_sodium_mg": 800,
    "carb_range_g": [
      40,
      55
    ],
    "cuisine_pref": "Filipino",
    "dislikes": [],
    "cooking_ability": "full",
    "address_zone": "SoMa",
    "meals_per_week": 7
  },
  {
    "id": 1009,
    "name": "Jose Bautista",
    "referring_hospital": "Chinese Hospital",
    "diet_orders": [
      "diabetic",
      "cardiovascular"
    ],
    "allergies": [],
    "max_sodium_mg": 600,
    "carb_range_g": [
      45,
      60
    ],
    "cuisine_pref": "Italian",
    "dislikes": [],
    "cooking_ability": "full",
    "address_zone": "Richmond",
    "meals_per_week": 5
  },
  {
    "id": 1010,
    "name": "Dmitri Khan",
    "referring_hospital": "UCSF Medical Center",
    "diet_orders": [
      "diabetic"
    ],
    "allergies": [
      "peanut",
      "dairy"
    ],
    "max_sodium_mg": 800,
    "carb_range_g": [
      45,
      65
    ],
    "cuisine_pref": "Mexican",
    "dislikes": [
      "cilantro"
    ],
    "cooking_ability": "stovetop",
    "address_zone": "Excelsior",
    "meals_per_week": 5
  },
  {
    "id": 1011,
    "name": "Benigno Torres",
    "referring_hospital": "CPMC Van Ness",
    "diet_orders": [
      "cardiovascular"
    ],
    "allergies": [],
    "max_sodium_mg": 650,
    "carb_range_g": [
      35,
      70
    ],
    "cuisine_pref": "Mexican",
    "dislikes": [],
    "cooking_ability": "stovetop",
    "address_zone": "Tenderloin",
    "meals_per_week": 10
  },
  {
    "id": 1012,
    "name": "Mary Jones",
    "referring_hospital": "Kaiser Permanente San Francisco",
    "diet_orders": [
      "diabetic"
    ],
    "allergies": [],
    "max_sodium_mg": 800,
    "carb_range_g": [
      45,
      60
    ],
    "cuisine_pref": "Chinese",
    "dislikes": [
      "coconut milk",
      "cilantro"
    ],
    "cooking_ability": "full",
    "address_zone": "Tenderloin",
    "meals_per_week": 7
  },
  {
    "id": 1013,
    "name": "Priya Ali",
    "referring_hospital": "Zuckerberg San Francisco General",
    "diet_orders": [
      "cardiovascular"
    ],
    "allergies": [],
    "max_sodium_mg": 650,
    "carb_range_g": [
      45,
      75
    ],
    "cuisine_pref": "Vietnamese",
    "dislikes": [],
    "cooking_ability": "stovetop",
    "address_zone": "Mission",
    "meals_per_week": 7
  },
  {
    "id": 1014,
    "name": "Darnell Aquino",
    "referring_hospital": "Zuckerberg San Francisco General",
    "diet_orders": [
      "diabetic"
    ],
    "allergies": [
      "sesame"
    ],
    "max_sodium_mg": 800,
    "carb_range_g": [
      40,
      55
    ],
    "cuisine_pref": "Filipino",
    "dislikes": [
      "beef"
    ],
    "cooking_ability": "stovetop",
    "address_zone": "Chinatown",
    "meals_per_week": 5
  },
  {
    "id": 1015,
    "name": "Keisha Singh",
    "referring_hospital": "CPMC Van Ness",
    "diet_orders": [
      "cardiovascular",
      "diabetic",
      "renal"
    ],
    "allergies": [
      "soy",
      "peanut"
    ],
    "max_sodium_mg": 500,
    "carb_range_g": [
      40,
      55
    ],
    "cuisine_pref": "Vietnamese",
    "dislikes": [
      "cilantro"
    ],
    "cooking_ability": "full",
    "address_zone": "Excelsior",
    "meals_per_week": 10
  },
  {
    "id": 1016,
    "name": "Benigno Bautista",
    "referring_hospital": "Zuckerberg San Francisco General",
    "diet_orders": [
      "renal"
    ],
    "allergies": [
      "fish",
      "shellfish"
    ],
    "max_sodium_mg": 500,
    "carb_range_g": [
      35,
      70
    ],
    "cuisine_pref": "Mexican",
    "dislikes": [
      "coconut milk",
      "eggplant"
    ],
    "cooking_ability": "microwave",
    "address_zone": "Western Addition",
    "meals_per_week": 7
  },
  {
    "id": 1017,
    "name": "Lourdes Washington",
    "referring_hospital": "Chinese Hospital",
    "diet_orders": [
      "diabetic"
    ],
    "allergies": [],
    "max_sodium_mg": 800,
    "carb_range_g": [
      40,
      55
    ],
    "cuisine_pref": "Chinese",
    "dislikes": [],
    "cooking_ability": "microwave",
    "address_zone": "Excelsior",
    "meals_per_week": 7
  },
  {
    "id": 1018,
    "name": "Dmitri Bautista",
    "referring_hospital": "Saint Francis Memorial",
    "diet_orders": [
      "cardiovascular"
    ],
    "allergies": [
      "tree_nut"
    ],
    "max_sodium_mg": 600,
    "carb_range_g": [
      35,
      70
    ],
    "cuisine_pref": "American",
    "dislikes": [
      "kidney beans"
    ],
    "cooking_ability": "stovetop",
    "address_zone": "Sunset",
    "meals_per_week": 10
  },
  {
    "id": 1019,
    "name": "Dmitri Rodriguez",
    "referring_hospital": "Kaiser Permanente San Francisco",
    "diet_orders": [
      "cardiovascular"
    ],
    "allergies": [],
    "max_sodium_mg": 700,
    "carb_range_g": [
      40,
      70
    ],
    "cuisine_pref": "Chinese",
    "dislikes": [
      "eggplant"
    ],
    "cooking_ability": "microwave",
    "address_zone": "SoMa",
    "meals_per_week": 10
  },
  {
    "id": 1020,
    "name": "Robert Singh",
    "referring_hospital": "Kaiser Permanente San Francisco",
    "diet_orders": [
      "diabetic"
    ],
    "allergies": [
      "shellfish",
      "tree_nut",
      "egg"
    ],
    "max_sodium_mg": 800,
    "carb_range_g": [
      40,
      55
    ],
    "cuisine_pref": "Vietnamese",
    "dislikes": [
      "coconut milk",
      "lentils"
    ],
    "cooking_ability": "microwave",
    "address_zone": "Tenderloin",
    "meals_per_week": 10
  },
  {
    "id": 1021,
    "name": "Maria Reyes",
    "referring_hospital": "Zuckerberg San Francisco General",
    "diet_orders": [
      "cardiovascular"
    ],
    "allergies": [],
    "max_sodium_mg": 700,
    "carb_range_g": [
      45,
      75
    ],
    "cuisine_pref": "Mexican",
    "dislikes": [
      "beef",
      "mushrooms"
    ],
    "cooking_ability": "stovetop",
    "address_zone": "Excelsior",
    "meals_per_week": 5
  },
  {
    "id": 1022,
    "name": "Dmitri Singh",
    "referring_hospital": "UCSF Medical Center",
    "diet_orders": [
      "renal",
      "cardiovascular"
    ],
    "allergies": [
      "gluten"
    ],
    "max_sodium_mg": 550,
    "carb_range_g": [
      45,
      75
    ],
    "cuisine_pref": "Chinese",
    "dislikes": [
      "coconut milk"
    ],
    "cooking_ability": "microwave",
    "address_zone": "Visitacion Valley",
    "meals_per_week": 10
  },
  {
    "id": 1023,
    "name": "David Singh",
    "referring_hospital": "CPMC Van Ness",
    "diet_orders": [
      "cardiovascular"
    ],
    "allergies": [
      "sesame"
    ],
    "max_sodium_mg": 700,
    "carb_range_g": [
      35,
      70
    ],
    "cuisine_pref": "Mediterranean",
    "dislikes": [
      "kidney beans"
    ],
    "cooking_ability": "microwave",
    "address_zone": "Mission",
    "meals_per_week": 7
  },
  {
    "id": 1024,
    "name": "Benigno Khan",
    "referring_hospital": "Saint Francis Memorial",
    "diet_orders": [
      "low-sodium"
    ],